{
  "$schema": "https://json-schema.org/draft/2020-12/schema",
  "type": "object",
  "required": [
    "_id",
    "fecha",
    "id_cliente",
    "id_empleado",
    "id_gafa",
    "id_venta",
    "tipo_de_pago"
  ],
  "properties": {
    "_id": {
      "$ref": "#/$defs/ObjectId"
    },
    "fecha": {
      "$ref": "#/$defs/Date"
    },
    "id_cliente": {
      "type": "integer"
    },
    "id_empleado": {
      "type": "integer"
    },
    "id_gafa": {
      "type": "integer"
    },
    "id_venta": {
      "type": "integer"
    },
    "tipo_de_pago": {
      "type": "string"
    }
  },
  "$defs": {
    "ObjectId": {
      "type": "object",
      "properties": {
        "$oid": {
          "type": "string",
          "pattern": "^[0-9a-fA-F]{24}$"
        }
      },
      "required": [
        "$oid"
      ],
      "additionalProperties": false
    },
    "Date": {
      "type": "object",
      "properties": {
        "$date": {
          "type": "string",
          "format": "date-time"
        }
      },
      "required": [
        "$date"
      ],
      "additionalProperties": false
    }
  }
}